{
  "schema_version": "1.0.0",
  "record_id": "nick-worldmaker-state-v1",
  "record_status": "active",
  "as_of": "2026-07-18T11:34:02+07:00",
  "repository": {
    "full_name": "KhunAlek/nick-worldmaker",
    "inspected_branch": "main",
    "inspection_commit": "f2409a01ab4c3adb135c6b35ddc00b794d856642"
  },
  "authority": {
    "changing_state_authority": "data/state/Nick_Worldmaker_State_Record_v1.json after schema validation and evidence reconciliation; activation takes effect only when the adopting pull request is merged into main",
    "permanent_rules_location": "docs/governance/permanent/ and future AGENTS.md; not duplicated here",
    "conflict_policy": "Use evidence only within its proper state dimension; preserve older claims as history and mark same-scope conflicts unresolved instead of selecting by date alone."
  },
  "no_side_effects": {
    "declarative_only": true,
    "releases": false,
    "unlocks": false,
    "deploys": false,
    "advances_learner": false,
    "modifies_repository": false
  },
  "current_state": {
    "learner_summary": {
      "statement": "Nick has genuine validated approval for M1–M3; M4 is his exact next genuine mission, and no later learner completion is supported.",
      "evidence": [
        {"source_id": "main-tracker-2026-07-15", "scope": "learner", "claim": "Records genuine M1–M3 approval and M4 as Nick's next mission."},
        {"source_id": "july18-tracker", "scope": "learner", "claim": "Confirms M1–M3 approved, M4 next, and no learner progress change during M8 preparation."}
      ]
    },
    "release_summary": {
      "statement": "At inspected main commit f2409a01ab4c3adb135c6b35ddc00b794d856642, M3–M7 are released and live-passed; M8 is merged but remains the first unreleased mission.",
      "evidence": [
        {"source_id": "main-release-manifest", "scope": "release", "claim": "Lists M3–M7 as released and M8–M15 as unreleased."},
        {"source_id": "main-release-manifest", "scope": "live_pass", "claim": "Lists M3–M7 as live-passed."},
        {"source_id": "m7-final-evidence", "scope": "live_pass", "claim": "Retains M7 workflow 29571404259 and successful isolation, unlock, and cleanup results."}
      ]
    },
    "active_preparation": {
      "status": "merged",
      "mission_id": "V1-M08",
      "branch": null,
      "pull_request": 6,
      "merged_to_inspected_main": true,
      "evidence": [
        {"source_id": "m8-pr6-merged", "scope": "preparation", "claim": "PR #6 closed and squash-merged from approved head c1ecb06c8085623bb9a7d2f563ec49fb33c25cca."},
        {"source_id": "m8-main-merge", "scope": "implementation", "claim": "Main contains the approved M8 candidate at merge commit f2409a01ab4c3adb135c6b35ddc00b794d856642."},
        {"source_id": "july18-tracker", "scope": "human_usability", "claim": "Records human beginner-usability approval of the corrected M8 candidate."},
        {"source_id": "main-release-manifest", "scope": "release", "claim": "Confirms that merging did not promote M8 into the released mission sequence."}
      ]
    },
    "missions": [
      {
        "mission_id": "V1-M01",
        "learner_progress": {"status": "learner_approved", "note": "Genuinely approved for Nick.", "evidence": [{"source_id": "main-tracker-2026-07-15", "scope": "learner", "claim": "Current tracker includes M1 among Nick's genuine approvals."}]},
        "unlock": {"status": "consumed", "note": "Earlier sequential unlock already used; M1 is complete.", "evidence": [{"source_id": "main-tracker-2026-07-15", "scope": "unlock", "claim": "Current tracker places Nick beyond M1 with M1 approved."}]},
        "implementation": {"status": "unknown", "note": "Current implementation classification was not independently normalized for M1.", "evidence": []},
        "technical_test": {"status": "unknown", "note": "Historical success exists but no current test classification was selected for this baseline.", "evidence": []},
        "human_usability": {"status": "unknown", "note": "No exact current human-review evidence was selected for M1.", "evidence": []},
        "release": {"status": "unknown", "note": "The inspected M3–M15 release manifest does not classify M1.", "evidence": []},
        "live_pass": {"status": "unknown", "note": "The inspected M3–M15 live-pass manifest does not classify M1.", "evidence": []}
      },
      {
        "mission_id": "V1-M02",
        "learner_progress": {"status": "learner_approved", "note": "Genuinely approved for Nick.", "evidence": [{"source_id": "main-tracker-2026-07-15", "scope": "learner", "claim": "Current tracker includes M2 among Nick's genuine approvals."}]},
        "unlock": {"status": "consumed", "note": "Earlier sequential unlock already used; M2 is complete.", "evidence": [{"source_id": "main-tracker-2026-07-15", "scope": "unlock", "claim": "Current tracker places Nick beyond M2 with M2 approved."}]},
        "implementation": {"status": "unknown", "note": "Current implementation classification was not independently normalized for M2.", "evidence": []},
        "technical_test": {"status": "unknown", "note": "Historical success exists but no current test classification was selected for this baseline.", "evidence": []},
        "human_usability": {"status": "unknown", "note": "No exact current human-review evidence was selected for M2.", "evidence": []},
        "release": {"status": "unknown", "note": "The inspected M3–M15 release manifest does not classify M2.", "evidence": []},
        "live_pass": {"status": "unknown", "note": "The inspected M3–M15 live-pass manifest does not classify M2.", "evidence": []}
      },
      {
        "mission_id": "V1-M03",
        "learner_progress": {"status": "learner_approved", "note": "Genuine production evaluator approval reported on 17 July.", "evidence": [{"source_id": "main-tracker-2026-07-15", "scope": "learner", "claim": "Records Nick's genuine M3 work, production APPROVED result, and distinguishes it from fixtures."}]},
        "unlock": {"status": "consumed", "note": "M3's approval produced the exact M4 unlock.", "evidence": [{"source_id": "main-tracker-2026-07-15", "scope": "unlock", "claim": "Records exact M4 unlock after genuine M3 approval and no later completion."}]},
        "implementation": {"status": "merged", "note": "M3 implementation exists on inspected main.", "evidence": [{"source_id": "inspection-commit", "scope": "implementation", "claim": "Inspected main contains M3 lesson, runtime, evaluator, and release sources."}]},
        "technical_test": {"status": "tested", "note": "Retained release and closure evidence supports technical testing.", "evidence": [{"source_id": "main-release-manifest", "scope": "technical_test", "claim": "Manifest records required source and release-test gates for M3."}]},
        "human_usability": {"status": "human_approved", "note": "Repaired M3 lesson passed human re-review.", "evidence": [{"source_id": "main-tracker-2026-07-15", "scope": "human_usability", "claim": "Records repaired M3 lesson and passed human beginner-usability re-review."}]},
        "release": {"status": "released", "note": "Released on inspected main.", "evidence": [{"source_id": "main-release-manifest", "scope": "release", "claim": "Lists V1-M03 in released_ids."}]},
        "live_pass": {"status": "live_passed", "note": "Live-passed on inspected main.", "evidence": [{"source_id": "main-release-manifest", "scope": "live_pass", "claim": "Lists V1-M03 in live_passed_ids."}]}
      },
      {
        "mission_id": "V1-M04",
        "learner_progress": {"status": "not_started", "note": "Exact next genuine mission; no completion inferred.", "evidence": []},
        "unlock": {"status": "unlocked", "note": "Exact next mission unlocked by genuine M3 approval.", "evidence": [{"source_id": "main-tracker-2026-07-15", "scope": "unlock", "claim": "Records M4 as the exact next genuine mission after M3 approval."}]},
        "implementation": {"status": "merged", "note": "M4 implementation exists on inspected main.", "evidence": [{"source_id": "inspection-commit", "scope": "implementation", "claim": "Inspected main contains M4 learner and runtime sources."}]},
        "technical_test": {"status": "tested", "note": "Retained release tests exist.", "evidence": [{"source_id": "main-release-manifest", "scope": "technical_test", "claim": "Manifest records required release-test gates for M4."}]},
        "human_usability": {"status": "unknown", "note": "No exact current human-review evidence was selected for M4.", "evidence": []},
        "release": {"status": "released", "note": "Released on inspected main.", "evidence": [{"source_id": "main-release-manifest", "scope": "release", "claim": "Lists V1-M04 in released_ids."}]},
        "live_pass": {"status": "live_passed", "note": "Live-passed on inspected main.", "evidence": [{"source_id": "main-release-manifest", "scope": "live_pass", "claim": "Lists V1-M04 in live_passed_ids."}]}
      },
      {
        "mission_id": "V1-M05",
        "learner_progress": {"status": "not_started", "note": "No genuine learner completion evidence.", "evidence": []},
        "unlock": {"status": "locked", "note": "No genuine M4 approval supports unlocking M5.", "evidence": []},
        "implementation": {"status": "merged", "note": "M5 implementation exists on inspected main.", "evidence": [{"source_id": "inspection-commit", "scope": "implementation", "claim": "Inspected main contains M5 learner and runtime sources."}]},
        "technical_test": {"status": "tested", "note": "Retained release tests exist.", "evidence": [{"source_id": "main-release-manifest", "scope": "technical_test", "claim": "Manifest records required release-test gates for M5."}]},
        "human_usability": {"status": "unknown", "note": "No exact current human-review evidence was selected for M5.", "evidence": []},